,id,name,singer,img,lyrics,jenre
457,4532820,뜨래요 (Feat. 앙리 Of 3B) ,배치기,https://cdnimg.melon.co.kr/cm/album/images/022/43/562/2243562_500.jpg/melon/resize/282/quality/80/optimize, 쏟아진 빗물 사이로   니 모습 보였는데  내 손엔 잡히지 않아   눈에 눈물 고였는데   불러도 오지를 않아   애타는 내 맘 알고 있을까   몰라 니 생각은 뭘까  아쉬울 것 없다   단 한치의 후회도 없이   너와나 사랑했다 믿었는데  아직도 남은 게 많아 미련은   내 안에 남아 있기로  더 머물기로   막힘 없이 불타는 사랑했 뜨래요  서울 밤거릴 달리고 있어   달리고 달려도 닿지 않는   너에게로 다 잊기로 했었는데   잊혀지지 않는 것은 왜일까  오 밟고 또 밟아도   밤처럼 긴 어둠위로   너에게로 가고 있어  빙판 같아 달빛을   머금은 아스팔트는  그 위로 스케치 하듯 악셀 점프  닿을 듯 말듯한 이 도시하늘   나를 위로 하듯 숨죽인 차들  너가 떠난 그날부터 돼버린 길치야   나는 빌딩숲 사이 쏘다니며  때마침 차 안에 흐르는 노래는   같이 자주 들었던  Killing Me Softly  혼자라는 것에 익숙할 때쯤   나를 찾아오는 이 습관의 끈  바람에 섞인 체 아주   미세하게 느껴지는   너의 향긴 자극 하지 나의 코끝  가로등 불빛들은 눈물 속에   계속 번지고 미련은 던지고   이제는 각자 알아서 가라며   하염없이 깜빡 거리기만 하는   도로 위 노란 신호  막힘 없이 불타는 사랑했 뜨래요  서울 밤거릴 달리고 있어   달리고 달려도 닿지 않는   너에게로 다 잊기로 했었는데   잊혀지지 않는 것은 왜일까  오 밟고 또 밟아도  밤처럼 긴 어둠위로   너에게로 가고 있어  긴긴 여기 길 위로   좀 더 던져 날 위로해  쓰렸던 맘이 번져 물들었던 밤도  긴긴 여기 길 위로   좀 더 던져 날 위로해  언제쯤 맘은 아물까  핀 조명 같은 달이 뜬  도시의 밤 속 난리굿  공기를 가르며 달리는  기분은 driving in   말리부  핀 조명 같은 달이 뜬 도시의 밤 속 난리굿 공기를 가르며 달리는 기분은 driving in  말리부 막힘 없이 불타는 사랑했 뜨래요 서울 밤거릴 달리고 있어  달리고 달려도 닿지 않는  너에게로 다 잊기로 했었는데  잊혀지지 않는 것은 왜일까 오 밟고 또 밟아도 밤처럼 긴 어둠위로  너에게로 가고 있어  ,랩/힙합
458,4711065,우산 ,윤하 (YOUNHA),https://cdnimg.melon.co.kr/cm/album/images/022/63/475/2263475_500.jpg?89bc963e2148d4081efec8bae2239e25/melon/resize/282/quality/80/optimize, 어느새 빗물이 내 발목에 고이고  참았던 눈물이 내 눈가에 고이고  I cry 어딜 가도 떠있는 내 작은 먹구름 까치발 딛고 잡아보려고 해도 키가 닿지 않아 항상 손끝 위에  어느새 빗물이 내 발목에 고이고 참았던 눈물이 내 눈가에 고이고  I cry 그대는 내 머리위에 우산 어깨위에 차가운 비 내리는 밤 내 곁에 그대가 습관이 돼버린 나 난 그대 없이는 안돼요 alone in the rain 어딜 가도 내 뒤를 쫓는  나만의 먹구름 창문을 닫고 끝내 눈을 감아도 곧 나를 깨우는 차가운 한방울 어느새 빗물이 내 발목에 고이고 참았던 눈물이 내 눈가에 고이고  I cry 그대는 내 머리위에 우산 어깨위에 차가운 비 내리는 밤 내 곁에 그대가 습관이 돼버린 나 난 그대 없이는 안돼요  alone in the rain 나의 곁에 그대가 없기에 내 창밖에 우산을 들고  기다리던 그대  I cry 그대는 내 머리위에 우산 어깨위에 차가운 비 내리는 밤 내 곁에 그대가 습관이 돼버린 나 난 그대 없이는 안돼요  I need you back in my life 그대는 내 머리위에 우산 어깨위에 차가운 비 내리는 밤 내 곁에 그대가 없는 반쪽의 세상 그댄 나 없이는 안돼요  forever in the rain  forever in the rain forever in the rain forever in the rain  ,발라드
459,5419682,"BORN HATER (Feat. 빈지노, 버벌진트, B.I, MINO, BOBBY) ",에픽하이 (EPIK HIGH),https://cdnimg.melon.co.kr/cm/album/images/022/86/432/2286432_500.jpg/melon/resize/282/quality/80/optimize,None,랩/힙합
460,4686392,Good Luck ,비스트,https://cdnimg.melon.co.kr/cm/album/images/022/60/842/2260842_500.jpg/melon/resize/282/quality/80/optimize, Why why you leave me alone baby  I'm still still loving you  넌 지금 나를 두고 떠나가지만  행복하길 바랄게  넌 입버릇처럼 항상 내게 말했지  언젠가 올 너와 나의  마지막을  난 입버릇처럼  항상 너에게 말했지  내가 할 수 있는  모든 걸 다 해 널 지킨다고  I wanna  Hold you tight  Make you mine  Never leave me alone  너 하나만 바라는데  난 그거면 충분한데  결국엔 모든 게 어긋나 버렸어  이런 나를 두고 떠나가니 왜  Good luck baby Good luck to you  꼭 행복해야 해  너만 보는 날  너 하나밖에 없던 날  두고 떠나갔다면  Good luck baby Good luck to you  누구를 만나도  네가 내게 남긴 상처만큼  넌 더 행복해야 해  I hate you love you  하루에도 몇 번  Up and down  Feels like an elevator  Heal me I'm heartsick  There ain't no cure for my disease  너덜너덜해 난 너 때문에  네가 남긴 상처의 크기는  가늠이 안 돼  이런 상황에 난 널 위해  두 손을 모으네  I pray for ya Good luck to ya  I wanna  Hold you tight  Make you mine  Never leave me alone  너 하나만 바라는데  난 그거면 충분한데  결국엔 모든 게 어긋나 버렸어  이런 나를 두고 떠나가니 왜  Good luck baby Good luck to you  꼭 행복해야 해  너만 보는 날  너 하나밖에 없던 날  두고 떠나갔다면  Good luck baby Good luck to you  누구를 만나도  네가 내게 남긴 상처만큼  넌 더 행복해야 해  더 행복해야 해  이거 하나만은 알고 가  나만큼 널 사랑할 사람 없단 걸  난 너에게 많은 이별 중 하나겠지만 넌 나에게 처음이자 마지막인 걸 Good luck baby Good luck to you 꼭 행복해야 해 너만 보는 날 너 하나밖에 없던 날 두고 떠나갔다면 Good luck baby Good luck to you 누구를 만나도 네가 내게 남긴 상처만큼 넌 더 행복해야 해  ,댄스
461,4714217,하늘색 약속 ,god,https://cdnimg.melon.co.kr/cm/album/images/022/63/804/2263804_500.jpg/melon/resize/282/quality/80/optimize, 세상엔 우리들만큼 누군가를 그리워하는 사람들이 많습니다 지금도 누군가를 그리워하고 있을 그 친구들에게 이 노래를 바칩니다 모여라 얘들아 왜 이렇게 사는 게 힘들기만 한지 어느새 서른 중반 맘엔 멍이 들지 도대체 뭘 잘못했길래 내게만 이래 전생에 뭔 죄를 졌길래 안 보이는 미래 시간은 가고 나이는 차고 결혼은 자꾸 왜 안 하냐고 향수로 가리는 내 총각냄새 사라져가는 꿈 내 거친 텃새 god 이젠 빅 대디 아빠 어디가 나가야 할까 god와 JYP 그 때 그 시절 그리워 서일까 오늘밤 같이 뛰고 같이 불러줘 우리 웃으면서 노래해 헤어질 때 우리 다시 만나자고 맹세했던 그 약속 지키려고 하늘색 풍선 가득했던 You and Me 오래 기다리게 해서 미안해 데니 계상 호영과 태우 그리고 난 누구 아저씨 쭌 JYP보다 나이 많은 아저씨 아이돌계의 Wanna be 후배들 인사도 두 번 90도 꾸벅 그만해 꾸벅 난 쿨 한 9번 타자야 내가 홈런 쳐줄게 Did I keep my promise Hit it Danny 너무 어두워 길이 보이지 않아 지난 몇 년 동안 길 위에 나 혼자 어두운 터널 속에 흔들거리는 촛불 하나 꺼질까 봐 앞만 보면서 달려왔나 어느 날 문득 고갤 들어보니 새파란 하늘이 하늘색 물결이 언제나 그대로 나를 감싸 안아 날 바라보는 곳으로 두 팔 벌려 힘차게 날아 god 이젠 빅 대디 아빠 어디가 나가야 할까 god와 JYP 그 때 그 시절 그리워 서일까 오늘밤 같이 뛰고 같이 불러줘 우리 웃으면서 노래해 헤어질 때 우리 다시 만나자고 맹세했던 그 약속 지키려고 하늘색 풍선 가득했던 You and Me 오래 기다리게 해서 미안해 그대 두 눈가에 흐르는 눈물 내가 또 닦아 줄 테니 그때 우리가 불렀던 기억 저편에 묻어뒀었던 그 노래 함께 다시 불러줘 헤어질 때 우리 다시 만나자고 맹세했던 그 약속 지키려고 하늘색 풍선 가득했던 You and Me 오래 기다리게 해서 미안해 헤어질 때 우리 다시 만나자고 맹세했던 그 약속 지키려고 하늘색 풍선 가득했던 You and Me 오래 기다리게 해서 미안해 god 이젠 빅 대디 아빠 어디가 나가야 할까 god와 JYP 그 때 그 시절 그리워 서일까 하늘색 풍선 가득했던 You and Me 오래 기다리게 해서 미안해  ,발라드
462,4591400,JACKPOT ,블락비 (Block B),https://cdnimg.melon.co.kr/cm/album/images/022/50/057/2250057_500.jpg/melon/resize/282/quality/80/optimize, Jackpot  저 오빠들 이상해 야호 터졌다 Ja Ja Ja Jackpot The 7th album 7 members 7 seasons representer Poptime check it out Z I C O 인간의 욕심은 끝이 없고 같은 실수를 반복하지 너그럽게 살면서 대박을 노린다면 어림 반푼어치 우린 운명의 주사위를 던졌고 한치 오차도 용납 못하지 Aight Get rich or die 살아서 나가자 Nobody nobody knows Fit한 턱시도와 Brand new shoes 여비서와 Well being food 근사하게 외출 준비 눈떠보니까 꿈이야 난 지금 레이스 중 내 출세가 남에겐 Bad news Keep running running and running running and 박진감있게 I’m on my way 먼저 가 있을게 처음엔 다들 혀를 차고 어리석다 해 귀를 닫고 노래해 띠띠리라띠때 파이팅 넘치게 떼창 떼창 떼창해라 We hit the jackpot baby 라라라 라랄라 라랄라 랄라랄라 라라라 라랄라 터졌다 Ja Ja Ja Jackpot 라라라 라랄라 라랄라 랄라랄라 라라라 라랄라 Aight 나이를 먹어도 지갑은 탄력 넘치겠지 헛스윙 날려도 나 나이스샷이라는 Caddie 나를 무시했던 놈들에게 복수 대신 악수를 건네네 조심해 넥타이와 손목시계는 목줄 또는 수갑으로 변해 변해 가는 행복의 기준 난 인생을 배팅 중 요령 피우다간 잃을 게 더 많아져 oh 자신감 하나면 게임은 끝 기다려 My lady들 Keep running running and running running and 박진감있게 I’m on my way 먼저 가 있을게 처음엔 다들 혀를 차고 어리석다 해 귀를 닫고 노래해 띠띠리라띠때 파이팅 넘치게 떼창 떼창 떼창해라 We hit the jackpot baby 라라라 라랄라 라랄라 랄라랄라 라라라 라랄라 터졌다 Ja Ja Ja Jackpot 라라라 라랄라 라랄라 랄라랄라 라라라 라랄라 Don’t bring me down bring me down 위기여도 Swinging hard Break down break down now 밍기적거리지마 꽃피는 봄이 온다면 배짱 있게 JACKPOT I’m on my way 먼저 가 있을게 처음엔 다들 혀를 차고 어리석다 해 귀를 닫고 노래해 띠띠리라띠때 파이팅 넘치게 떼창 떼창 떼창해라 We hit the jackpot baby 라라라 라랄라 uh Luxury Luxury life 라라라 라랄라 Get that money money get that right 라라라 라랄라 Luxury Luxury life Anyway we’re playing hard to get lucky 라랄라 랄라랄라 라  ,댄스
463,4771771,빨개요 ,현아,https://cdnimg.melon.co.kr/cm/album/images/022/69/895/2269895_500.jpg/melon/resize/282/quality/80/optimize, So cool 하게 더 Hot 하게   레드 립스틱 좀 더 빨갛게  빨갛게  So cool 하게 더 Hot 하게   레드 립스틱 좀 더 빨갛게  빨갛게  새빨간 립스틱을 바른   나는 빨개요 빨개요  깨물어 주고 싶은   애교가 예술이에요  밤마다 내가 생각나   Like 매콤한 라면  먼저 들어와 봐 내가 좋다면  현아's back uh 웬만한 애들 보다   잘 빠진 몸매는 내겐 Full option  몸 좀 풀고 달려 보려니까   빨간 거 그게 나니까   이제 무대 위로 올라가 볼까  날 두고 떠나지 마   나 지금 너무나 외롭단 말이야  너만은 나를 떠나지 마   여긴 나 하나밖에 없다고  나 지금 변해 버릴지 몰라  원숭이 엉덩이는 빨개   What 빨간 건 현아 현아는 Yeah  원숭이 엉덩이는 빨개   What 빨간 건 현아 현아는 Ah  Oh eh oh eh oh  Uh uh 빨간 건 현아  Oh eh oh eh oh  Uh uh 빨간 건 현아  So cool 하게 더 Hot 하게   레드 립스틱 좀 더 빨갛게  빨갛게  So cool 하게 더 Hot 하게   레드 립스틱 좀 더 빨갛게  빨갛게  다 그만해 따끔하게  혼내 줄 테니까 엉덩이 대  감당 안 돼 밤마다   Say H Y U N 그리고 A  죽이는 댄스 무대 위 킬러  콧대는 하늘을 찔러  긴 말은 생략할게  날 두고 떠나지 마 나  지금 너무나 외롭단 말이야  너만은 나를 떠나지 마   여긴 나 하나밖에 없다고  나 지금 변해 버릴지 몰라  원숭이 엉덩이는 빨개   What 빨간 건 현아 현아는 Yeah  원숭이 엉덩이는 빨개   What 빨간 건 현아 현아는 Ah  Oh eh oh eh oh  Uh uh 빨간 건 현아  Oh eh oh eh oh  Uh uh 빨간 건 현아  빨간 건 현아  현아는 빨개요 현아는 빨개요  현아는 빨개요 빨간 건 현아  현아는 빨개요  날 두고 떠나지 마 나   지금 너무나 외롭단 말이야  너만은 나를 떠나지 마   여긴 나 하나밖에 없다고  나 지금 변해 버릴지 몰라  원숭이 엉덩이는 빨개   What 빨간 건 현아 현아는 Yeah  원숭이 엉덩이는 빨개  What 빨간 건 현아 현아는 Ah  Oh eh oh eh oh Uh uh 빨간 건 현아 Oh eh oh eh oh  Uh uh 빨간 건 현아  ,댄스
464,5442687,내 생애 가장 행복한 시간 (Feat. 허각) ,MC몽,https://cdnimg.melon.co.kr/cm/album/images/022/88/687/2288687_500.jpg/melon/resize/282/quality/80/optimize, 그땐 그랬어 막 잘 나갈 때라서 돈에 환장해 독이 찰 때라서 없던 놈이 뭐가 생기니까 끝없는 욕심은 더 땡기니까 여자는 더 꼬여 사람이 우습게 보여 자신을 괴물로 만드니까 내가 내 무덤을 파고 파니깐 내 사람들 하나 둘 떠나니까 억짜리 시계 팬트 하우스 스윗 노래 부르는 기계 몇 십 억의 수입 생각 없는 기부 믿음 없던 기도 밤이면 밤마다 덮치는 파도 이상해 그때가 안 그리워 그대가 있음에 하나도 안 두려워 아둥바둥 싸우고 사는 사람같이 이제야 내 모습이 안 더러워 사랑이 없는 인적 없는 홀로 버려진 외딴 섬 바람에 부딪혀 그대 이름마저 지운 난 사랑한단 말에 울컥 다 쏟는다 내 생애 가장 행복한 시간 너와 나는 트러블 스캔들 떠나가는 팬들 요즘 유행은 뭔지 잃어버린 트렌드 아들과 같이 숨어버린 엄마 그 분에겐 간절한 기도만이 평화 몰래 듣지 말아요 내 노래 몰래 울지 말아요 두 볼에 꼬마 점쟁이야 네가 딱 맞췄어 이게 바로 불효 중에 불효자야 뉴스에 나온 횟수만큼이나 내려가는 호감지수 실수가 낳은 가수 사랑 받은 만큼 넌 더 혼나야 해 이상해 그때가 안 그리워 그대가 있음에 하나도 안 두려워 아둥바둥 싸우고 사는 사람같이 이제야 내 모습이 안 더러워 사랑이 없는 인적 없는 홀로 버려진 외딴섬 바람에 부딪혀 그대 이름마저 지운 난 사랑한단 말에 울컥 다 쏟는다 내 생애 가장 행복한 시간 너와 나는 그녀의 몰래 훔친 눈물 보면 다시 살고 싶고 나만 보면 웃어주는 너와 같이 살고 싶고 하늘을 뻗으며 너에게 하는 말 이 길의 끝에서 마지막 사랑을 I'm nothing without you I'm nothing without you 널 사랑해 그녀의 몰래 훔친 눈물 보면 다시 살고 싶고 나만 보면 웃어주는 너와 같이 살고 싶고 하늘을 뻗으며 너에게 하는 말 이 길의 끝에서 마지막 사랑아 하늘에 난 소리쳐요 사랑한단 말에 울컥 다 쏟는다 내 생애 가장 행복한 시간 너와 나는 그땐 그랬어 막 잘 나갈 때라서 그땐 그랬어 막 잘 나갈 때라서 그땐 그랬어 막 잘 나갈 때라서 그땐 그랬어 막 잘 나갈 때라서 이상해 그때가 안 그리워 그대가 있음에 하나도 안 두려워 그대가 있음에 하나도 안 두려워  ,랩/힙합
465,4478191,멘붕 (CL Solo) ,2NE1,https://cdnimg.melon.co.kr/cm/album/images/022/36/445/2236445_500.jpg/melon/resize/282/quality/80/optimize, 자 지켜봐라 이 진동의 힘 척추를 타고 내려온 이 느낌 꽃 한 송이 피우리라 못다 핀  Fire Fire 다 같이 불조심  이건 말로 하는 요가 뻣뻣한 자들은 한 번에 녹아 꼬리가 길면 반드시 잡힌다 세상은 요지경 짜가가 판친다 수리수리 마수리 수수리 사바하 네 영혼을 확 깨우는 자장가 저 위로 올라가 자신을 내려 봐 월화 수목 금토 일 Karma karma karma is  looking for you What u gonna do when  they come for you Karma karma karma is  gonna find you What u gonna do  보름달이 떴다 강강수월래 2ne1이 떴다 everybody sqalay 이 세상을 멱살을 흔드는 막춤 숨겨진 내 눈은 감별해 짝퉁 빠르디 빠른 난 뛰어 산토끼처럼 대박을 터뜨려 쌍코피처럼 헝클어진 머리에 풀리는 동공 멘탈은 붕괴 미션은 성공 비비디 바비디 부 하쿠나 마타타 지금 너의 무의식을 따라가 돌고 도는 이 세상을 바라봐 월화 수목 금토 일 Karma karma karma is  looking for you What u gonna do when  they come for you Karma karma karma is  gonna find you What u gonna do  How beautiful is this life How painful is this life How beautiful is this life How painful is this life  ,일렉트로니카
466,5415175,"화장 지웠어 (Feat. Zion.T, HA:TFELT) (No Make Up) ",개코,https://cdnimg.melon.co.kr/cm/album/images/022/85/974/2285974_500.jpg/melon/resize/282/quality/80/optimize, 뜨뜨미지근해 우리관계의 온도 끈끈한 듯 해도 좀 묽어진 점도 의무처럼 안부를 묻는 사이 그 바로 직전이 우리의 어정쩡한 지점 탱고 스텝처럼 한 발짝씩 주고받다가 느슨해졌을 때 니가 버티는 이유가 궁금해졌지 내 가벼움 때문인지 너 또한 날 관리하는 사람 중에 하나인지 술병을 줄 새운 다음에야 툭 튀어나오는 우발적인 행동들을 방어하다가도  어쩔 땐 다 받아주는 완급조절은 완전 선수야 선수 어쩌면 신의 영역 괜히 진지한 내가 좀 한심한 지금 시간은 태양 없는 한시야 건조한 대화 창안에서 난 녹았지만 아직 체크 안 한 듯해 숫자 1은 아직이야 이제는 내가 움직여야 할 때  감정이 증발하기전 상태 이 관계를 정의 하기는 너무 애매해 한참 전에 너에게 보낸 문자  답장을 기다리네 어디야 나올래 오빠 나 화장 지웠어 뜨뜨미지근해 우리관계의 온도 니 기준에 맞춰 유지하는 정도 애만 태우다 홀로 남은 정 때문에 하루에 두 세 번 허탈한 웃음지어 너만한 여잔 없단 건  귀가 닳도록 들었어 입장정리하긴 모험인가 싶어서 보험 같은 존재가 되기를 몇 번인가의 시들함 물 부어가면서 버텨 진도는 다 나갔고 지진 날 듯한 떨림의 진도는 전보다 다소 얌전해졌지만 취향 대화 함께한 술의 위안 이 기록들의 잔향이 잘 지워지지 않아 넌 내꺼인 듯 내꺼 아닌 내꺼라  소유했다 기고만장 할 수는 없잖아 너라는 방에 갇혀 자유를 결심한 지금 시간  밤샌 후 Moon 없는 한시야 이제는 내가 움직여야 할 때  감정이 증발하기전 상태  이 관계를 정의 하기는 너무 애매해 한참 전에 너에게 보낸 문자 답장을 기다리네 어디야 나올래 오빠 나 화장 지웠어 만남을 쉬엄 쉬엄하며 여지만 남겨둔 탓에 띄엄띄엄 연결된 감정의 버퍼링 습작처럼 미완성된 관계의 종지부를 찍고 싶어 넌 어떠니 정착을 겁냈던 건 내 문제 꽈배기 잠을 잤었던 어제 오늘밤엔 니 생각이 너무 궁금해지네 she said she said 사실 니가 고백해주길 니가 용기 내 내게 와주길 너를 기다리던 밤 이젠 지쳤는지도 몰라 아아아 담에 만나 이제는 내가 움직여야 할 때  감정이 증발하기전 상태 이 관계를 정의 하기는 너무 애매해 한참 전에 너에게 보낸 문자 답장을 기다리네 어디야 나올래 오빠 나 화장 지웠어 여보세요 여보세요 지영아 난데 어 지금 볼 수 있어 지금 나 화장 지웠는데 야 화장 지운 것도 귀여워 엄마 아빠가 아직 안 주무셔가지고 좀 그래 엄마 아빠 안 주무셔 너 내가 이렇게 안 나가려고 하는  이유를 모르겠어 너 너무 눈치가 없는 것 같아  나 잘래 그냥 끊어 잠깐 잠깐 여보세요  ,랩/힙합
467,4635740,Good-night Kiss ,전효성,https://cdnimg.melon.co.kr/cm/album/images/022/55/094/2255094_500.jpg/melon/resize/282/quality/80/optimize, Good-night Kiss 넌 너무 달콤해 잘자요 우리 애기 잠든 모습이 너무 달콤해 들리나요 우리 얘기 Oh My  Candy처럼 Sweet한 니 입술 K I S S I N G  My My  이건 너를 위한 Lullaby K I S S I N G  Kiss Me Baby  Good-night Kiss 넌 너무 달콤해 잘자요 우리 애기 잠든 모습이 너무 달콤해 들리나요 우리 얘기 Baby Kiss On My Kiss On My Kiss On My Lips 내 맘 Boom Boom That Zoom Zoom Let's Dance Dance Like This Baby Kiss On My Kiss On My Kiss On My Lips 니가 잠이 들기 전에 Kiss Me Baby  코 잘도 자는 너 숨소리마저도 가까이 듣고 싶어 It's Getting Getting So Hot In Here Hot In Here Oh My  Candy처럼 Sweet한 니 입술 K I S S I N G  My My  이건 너를 위한 Lullaby K I S S I N G  Kiss Me Baby  Good-night Kiss 넌 너무 달콤해 잘자요 우리 애기 잠든 모습이 너무 달콤해 들리나요 우리 얘기 Baby Kiss On My Kiss On My Kiss On My Lips 내 맘 Boom Boom That Zoom Zoom Let's Dance Dance Like This Baby Kiss On My Kiss On My Kiss On My Lips 니가 잠이 들기 전에 Kiss Me Baby  부드런 선율처럼 노래하는 우리만의 자장가 둘만의 언어로 말해줄게 그대 입술 위에 Hold Me Tight Good-night Kiss 넌 너무 달콤해 잘자요 우리 애기 잠든 모습이 너무 달콤해 들리나요 우리 얘기 Baby Kiss On My Kiss On My Kiss On My Lips 내 맘 Boom Boom That Zoom Zoom Let's Dance Dance Like This Baby Kiss On My Kiss On My Kiss On My Lips 니가 잠이 들기 전에 Kiss Me Baby  ,댄스
468,4382254,La Song ,비,https://cdnimg.melon.co.kr/cm/album/images/022/24/109/2224109_500.jpg?262173baed33f4e02a27d58643af9c01/melon/resize/282/quality/80/optimize, 뻔하디 뻔한 그렇게 하는  그런 놈은 아니에요 그러네요  말썽 많지만 순종적인  그런 귀염둥이에요  예뻐해줘요  라 라라라라 라라라  라라 라라 라라라  라 라라라라 라라라  라라 라라 라라라  1 2 3 4 show me what's you got  1 2 3 4 show me what's you got  난 누울 수 있는 땅은 많지  남들처럼 없어도 있는 척  외제차만 돌리지는 cheesy 와는   달라도 완전히 change  Follow me  Maserati ferrari Key는 필요 없어  난 몸둥아리  자체가 so rich 하니까   부티가나니까 그렇게 사니까  이런 신발끈을 꽉매 넥타이는 쫌 풀래 오늘은 다른 말 하기가 싫어 그냥 있는 티 내기는 싫어 오늘은 나 좀 할래 나처럼 쫙 빼 입고 오늘은 달려 그래 사실은 오늘 나 좀 빼 입었다 신발끈 라 라라라라 라라라 라라 라라 라라라 라 라라라라 라라라 라라 라라 라라라 아하 that's right here we go let's dance time everybody sing a song 라 라라라라 라라라 라라 라라 라라라 라 라라라라 라라라 라라 라라 라라라 라 라라라라 라라라 라라 라라 라라라 라 라라라라 라라라 라라 라라 라라라  ,댄스
469,4734489,I'm In Love ,에일리(AILEE),https://cdnimg.melon.co.kr/cm/album/images/022/65/100/2265100_500.jpg?59aa0dc11b1dc48480011df3493c3445/melon/resize/282/quality/80/optimize, I'm falling in love 알고 있나요 매일 그대만 생각해요 함께 있고 싶죠 언제부턴가 그대는 내 전부가 됐고 그대 없인 하루도 살 수가 없죠 I know 영원한 건 아무것도 없죠 믿고 싶어요 변하지 않길 만약 그대 나를 좋아한다면 날 사랑한다면 Let me know tell me please baby 난 그대만 생각할게요 오 그대에게 말할게요 love you 내 삶이 변한 거죠 그대도 나와 같은가요 Bye Bye sadness Hello my love 내 곁에 있어줘요 It's so amazing to be in love 그때 이미 시작한 거죠 사랑이란 건 우연이 아니라는 걸 운명이란 걸 만약 그대 나를 좋아한다면  날 사랑한다면 Let me know tell me please baby 난 그대만 생각할게요 오 그대에게 말할게요 love you 내 삶이 변한 거죠 그대도 나와 같은가요 Bye Bye sadness Hello my love 내 곁에 있어줘요 It's so amazing to be in love oh Baby 큰 시련이 와도 난 늘 그대의 곁에 있어요 believe swear you my love love  오 그대 내게 말해줘요 Oh Ye 사랑이 같은 거죠 그대 안에서 사랑해요 Bye Bye sadness Hello my love I will always be there It's so amazing to be in love  ,발라드
